,title,text,time,image,country,3let,countrycode
0, ΕΛΑΣ: Απαγορεύονται οι συγκεντρώσεις έως την 1η Φεβρουαρίου ,Ξαφνική απόφαση του Αρχηγού της ΕΛΑΣ απαγορεύει από σήμερα μέχρι και την 1η Φεβρουαρίου τις δημόσιες συναθροίσεις άνω των 100 ατόμων. Τι πρόστιμα θα κληθούν να πληρώσουν οι παραβάτες.,2021-01-26 07:34:00,https://www.news247.gr/img/4729/9122988/561000/w140/140/ap_21014503897002.jpg,ελλάδα,,GR
1, Μοσχάτο: Έβαλαν φωτιά σε αυτοκίνητα ,Τουλάχιστον τρία αυτοκίνητα κάηκαν απο φωτιά που έβαλαν άγνωστοι τα ξημερώματα στο Μοσχάτο.,2021-01-26 07:20:00,https://www.news247.gr/img/8724/9122966/383000/w140/140/mosxato.jpg,ελλάδα,,GR
2, Γερμανία: Πρόσκληση Μέρκελ στον Μπάιντεν να επισκεφθεί το Βερολίνο ,Η Άγγελα Μέρκελ προσκάλεσε τον Τζο Μπάιντεν να επισκεφθεί το Βερολίνο στην πρώτη τους τηλεφωνική συνομιλία αφότου ο αμερικανός πρόεδρος ανέλαβε την εξουσία.,2021-01-26 06:53:00,https://www.news247.gr/img/8953/9122959/758000/w140/140/merkel.jpg,γερμανία,,DE
3, Το ΚΙΝ.ΑΛ σε (πρόωρη) προεκλογική περίοδο ,"Μετά την πρωτοβουλία του Ανδρέα Λοβέρδου να ανακοινώσει επισήμως ότι θα είναι υποψήφιος, οι προβολείς μετατίθενται, από τις πολιτικές θέσεις του Κινήματος Αλλαγής στις εξελίξεις στο εσωτερικό του. Με ότι αυτό συνεπάγεται.",2021-01-26 06:37:00,https://www.news247.gr/img/2421/9122862/236000/w140/140/loverdos.jpg,ελλάδα,,GR
4, Βόρεια Μακεδονία: Αντιπαράθεση για την πρώτη απογραφή μετά από 19 χρόνια ,Ο πρόεδρος υπέγραψε διάταγμα για την απογραφή του πληθυσμού τον Απρίλιο του 2021. Σφοδρή αντιπαράθεση κυβέρνησης-αντιπολίτευσης.,2021-01-26 06:35:00,https://www.news247.gr/img/8368/9122942/481000/w140/140/stevo_pendarovski.jpg,μακεδονία,,MK
5, Διερευνητικές με Τουρκία: Μάρτιο ο 2ος γύρος και το χαμένο παιχνίδι των κυρώσεων ,Οι διερευνητικές επαφές Ελλάδας- Τουρκίας θα συνεχιστούν στην Αθήνα. Τι συζητήθηκε επί τρεισήμισι ώρες στην Κωνσταντινούπολη παρουσία και “ανθρώπου” του Ερντογάν και το “δώρο” της Γερμανίας ,2021-01-26 06:24:00,https://www.news247.gr/img/4275/9122511/407000/w140/140/diereynitikes.jpg,τουρκία,,TR
6, Ο ΣΥΡΙΖΑ είδε… Σαμαρά και «μπήκε» ,"«Πρεσάρει» την κυβέρνηση η αξιωματική αντιπολίτευση, στα εθνικά θέματα, μετά από την δημόσια διαφοροποίηση του Αντώνη Σαμαρά. Ακόμη και για σκιώδη πρωθυπουργό μιλούν στελέχη του ΣΥΡΙΖΑ.",2021-01-26 06:23:00,https://www.news247.gr/img/1004/9122913/432000/w140/140/samarasmitsotakis.jpg,ελλάδα,,GR
7," Εύα Καϊλή: Οι Γυναίκες σπάνε την σιωπή, βάζοντας τέλος στην ανοχή της κακοποίησης, παρενόχλησης και έμφυλης βίας ","Η Εύα Καϊλή, γράφει στο News 24/7 για το τέλος του φόβου, αλλά και την ανάγκη για ουσιαστική εφαρμογή της Σύμβασης της Κωνσταντινούπολης.",2021-01-26 06:20:00,https://www.news247.gr/img/5712/9111666/073000/w140/140/tsipras.jpg,ελλάδα,,GR
8, ΗΠΑ: Στη Γερουσία το κατηγορητήριο σε βάρος του Τραμπ - Όλη η διαδικασία ,"Στη Βουλή των Αντιπροσώπων το κατηγορητήριο σε βάρος του Ντόναλντ Τραμπ, του μοναδικού προέδρου των ΗΠΑ που βρέθηκε δύο φορές αντιμέτωπος με αποπομπή",2021-01-26 06:13:00,https://www.news247.gr/img/1895/9052060/791000/w140/140/trump.jpg,ελλάδα,,GR
9, Τράπεζες: Όλη η ατζέντα της χθεσινής τηλεδιάσκεψης με τους Θεσμούς ,Την χρήση τομή στο θέμα των πλειστηριασμών και της χρηματοδότησης της οικονομίας αναζήτησαν χθες τράπεζες και Θεσμοί και πλέον την σκυτάλη των διαπραγματεύσεων παραλαμβάνει σήμερα το οικονομικό επιτελείο.,2021-01-26 06:12:00,https://www.news247.gr/img/4620/9122929/137000/w140/140/trapeza.jpg,ελλάδα,,GR
10," Απέναντι στους ""κόφτες"" των θεσμών για το νέο πακέτο μέτρων η κυβέρνηση ",Το οικονομικό επιτελείο προσπαθεί να ετοιμάσει μια σειρά από μέτρα στήριξης της επιχειρηματικότητας ώστε να κρατήσει στη ζωή επαγγελματίες και εργαζόμενους.,2021-01-26 06:11:00,https://www.news247.gr/img/7193/9122934/043000/w140/140/staikouras.jpg,ελλάδα,,GR
11, Γερμανικός Τύπος: Στο 8% η αποτελεσματικότητα του εμβολίου της AstraZeneca ,"Αποτελεσματικότητα κάτω του 10% για τους άνω των 65 ετών φέρεται να έχει το εμβόλιο της AstraZeneca, σύμφωνα με γερμανικά ΜΜΕ. Διαψεύδει η εταιρεία",2021-01-26 06:10:00,https://www.news247.gr/img/6059/9101016/974000/w140/140/astra.jpg,ελλάδα,,GR
12," Ισραήλ: ""Ενθαρρυντικά"" τα πρώτα στοιχεία από τους εμβολιασμούς στη χώρα ",Τα προκαταρτικά στοιχεία δείχνουν ότι μόνο 20 από τους 128.600 ανθρώπους που έλαβαν και τις δύο δόσεις του εμβολίου προσβλήθηκαν στη συνέχεια από τον ιό SARS-CoV-2.,2021-01-26 02:56:00,https://www.news247.gr/img/9208/9122945/389000/w140/140/israel.jpg,ισραήλ,,IL
13, Καναδάς: Τρομοκρατική οργάνωση αξιώνει η Βουλή να χαρακτηριστεί η Proud Boys ,Η καναδική Βουλή καλεί την κυβέρνηση του Τριντό να αντιδράσει στην εξάπλωση οργανώσεων που διαδίδουν τη θεωρία περί ανωτερότητας της λευκής φυλής και το μίσος.,2021-01-26 02:32:00,https://www.news247.gr/img/2025/9122940/840000/w140/140/proud_boys.jpg,καναδάς,,CA
14, Χάριετ Τάμπμαν: Η πρώην σκλάβα και πολιτική ακτιβίστρια στο νέο χαρτονόμισμα των 20 δολαρίων ,Η Χάριετ Τάμπμαν θα γίνει η πρώτη Αφροαμερικανίδα προσωπικότητα που θα εμφανιστεί σε χαρτονόμισμα των ΗΠΑ. Θα αντικαταστήσει τον λαϊκιστή πρόεδρο Άντριου Τζάκσον.,2021-01-26 02:10:00,https://www.news247.gr/img/1242/9122936/671000/w140/140/harriet_tubman3.jpg,ελλάδα,,GR
15, Τζάνετ Γέλεν: Η πρώτη γυναίκα που αναλαμβάνει υπουργός Οικονομικών των ΗΠΑ ,Η Γερουσία ενέκρινε τον διορισμό της Τζάνετ Γέλεν. Θα αντικαταστήσει τον Στίβεν Μνούτσιν και θα είναι η πρώτη γυναίκα που θα αναλάβει το υπουργείο Οικονομικών.,2021-01-26 01:42:00,https://www.news247.gr/img/754/9122933/085000/w140/140/janet_yellen.jpg,ελλάδα,,GR
16, Μπάιντεν: Ανησυχία για την μεταχείριση του Ναβάλνι από την Ρωσία ,"""Να καταστήσουμε σαφές στη Ρωσία ότι ανησυχούμε πολύ για τη συμπεριφορά τους"", δήλωσε ο πρόεδρος των ΗΠΑ Τζο Μπάιντεν.",2021-01-26 01:22:00,https://www.news247.gr/img/1828/9122926/199000/w140/140/biden.jpg,ρωσία,,RU
17, Άρειος Πάγος: Επανεξέταση και μείωση της ποινής του ειδικού φρουρού - Είχε επιχειρήσει να βιάσει κοινωνική λειτουργό ,Ο νέος Ποινικός Κώδικας φέρνει ελάφρυνση της ποινής του ειδικού φρουρού που είχε καταδεικαστεί σε φυλάκιση 7 ετών και 10 μηνών όταν χτύπησε και επιχείρησε να βιάσει το 2012) κοινωνική λειτουργό. ,2021-01-26 01:04:00,https://www.news247.gr/img/2899/9122678/003000/w140/140/untitled_1.jpg,ελλάδα,,GR
18," Σοφία Μπεκατώρου: ""Μίλησα τώρα γιατί άκουσα ότι αποπλανεί παιδιά"" ","Η Σοφία Μπεκατώρου μίλησε ανοιχτά για την καταγγελία της για σεξουαλική κακοποίηση, για τα συναισθήματά της, για τα κακώς κείμενα της ΕΙΟ, αλλά και τους λόγους που ""έσπασε"" τη σιωπή της τώρα.",2021-01-26 00:34:00,https://www.news247.gr/img/356/9122908/667000/w140/140/bekatorou.jpg,ελλάδα,,GR
19, Εορτολόγιο: Ποιοι γιορτάζουν την Τρίτη 26 Ιανουαρίου ,Ποια ονόματα περιλαμβάνει σήμερα το εορτολόγιο.,2021-01-26 00:31:00,https://www.news247.gr/img/7595/9122856/760000/w140/140/ekklisia.jpg,ελλάδα,,GR
20, Ολλανδία: Δεύτερη μέρα ταραχών σε διαδηλώσεις κατά της απαγόρευσης κυκλοφορίας ,Να αυξήσει τον αριθμό των συλλήψεων εξουσιοδότησε την αστυνομία ο δήμαρχος του Ρότερνταμ μετά τα επεισόδια σε διαδηλώσεις κατά της απαγόρευσης κυκλοφορίας. ,2021-01-25 23:11:00,https://www.news247.gr/img/5570/9122886/852000/w140/140/ollandia250121.jpg,ολλανδία,,NL
21, Γαλλία: Οργή μετά την επίθεση εναντίον 15χρονου από συμμορία νέων στο Παρίσι ,Ο 15χρονος Γιούρι δέχτηκε άγριο ξυλοδαρμό από συμμορία νέων σε συνοικία του Παρισιού. Αντιδράσεις μετά την προβολή του βίντεο. Έρευνες για τα κίνητρα της επίθεσης.,2021-01-25 23:02:00,https://www.news247.gr/img/698/9122692/020000/w140/140/15xronos.jpg,γαλλία,,FR
22, Χάος στα σύνορα Τσεχίας - Γερμανίας: Ουρές για τεστ κορονοϊού ,"Εκατοντάδες πολίτες περίμεναν να κάνουν τεστ για τον κορονοϊό, ώστε να περάσουν στη Γερμανία από την Τσεχία, η οποία έχει χαρακτηριστεί χώρα υψηλού κινδύνου.",2021-01-25 22:54:00,https://www.news247.gr/img/8984/9122751/592000/w140/140/tsexia1.jpg,τσεχία,,CZ
23, Μάτι: Ευθύνες στην Πυροσβεστική επιρρίπτουν στελέχη της Τροχαίας και της ΕΛΑΣ ,"Αν η Πυροσβεστική είχε εισηγηθεί απομάκρυνση πολιτών από το Μάτι, η Αστυνομία και η Τροχαία είχε τη δυνατότητα να εφαρμόσει επιτυχώς το σχέδιο διάσωσης, σύμφωνα με κατηγορούμενους αξιωματικούς της ΕΛΑΣ. ",2021-01-25 22:35:00,https://www.news247.gr/img/1841/9122853/649000/w140/140/mati250121.jpg,ελλάδα,,GR
24, Βιασμός 11χρονης: Και για απειλές κατά της ζωής της κατέθεσε η αθλήτρια ,"Ο 38χρονος προπονητής φέρεται να απείλησε τη ζωή της αθλήτριας και της οικογένειάς της, προκειμένου να μη μιλήσει για την σεξουαλική κακοποίηση που υπέστη. Η ανήλικη είχε πάει στην Αστυνομία το 2013 χωρίς αποτέλεσμα.",2021-01-25 22:23:00,https://www.news247.gr/img/6927/9122825/584000/w140/140/proponitis.jpg,ελλάδα,,GR
25," Γερμανικό ""δώρο"" στην Τουρκία για τις διερευνητικές ","""Θετική ένδειξη"" χαρακτήρισε ο υπουργός Εξωτερικών της Γερμανίας την επανέναρξη των διερευνητικών επαφών Ελλάδας-Τουρκίας, λέγοντας πως ""δεν θα πρέπει να επιβαρυνθεί με κυρώσεις""",2021-01-25 22:22:00,https://www.news247.gr/img/9466/9122820/381000/w140/140/maas.jpg,τουρκία,,TR
26, Ο Μπέρνι Σάντερς έγινε (και) πλεχτό κουκλάκι με βελονάκι ,Κυκλοφόρησε συλλεκτική εκδοχή από κουκλάκι που απεικονίζει τον Μπέρνι Σάντερς από το Tobey Time Crochet. Η δημιουργός του πλεχτού δίνει οδηγίες για να το φτιάξουμε.,2021-01-25 22:18:00,https://www.news247.gr/img/6865/9122775/802000/w140/140/plexto.jpg,ελλάδα,,GR
27, Πάτρα: Σε ξεκαθάρισμα αποδίδεται το τροχαίο και η αιματηρή συμπλοκή - Κλινικά νεκρός ένας άνδρας ,Στο περιστατικό εμπλέκονται συνολικά 6 Αλβανοί. Οι μισοί επέβαιναν σε ένα όχημα που κατεδίωκε ένα άλλο όχημα στο οποίο επέβαιναν οι υπόλοιποι. Συγκρούστηκαν τα οχήματά τους και ξέσπασε η αιματηρή συμπλοκή.,2021-01-25 21:55:00,https://www.news247.gr/img/6692/9122823/435000/w140/140/patra250121.jpg,ελλάδα,,GR
28, Περιστέρι: Η τραγική ιστορία πίσω από τη σύλληψη γιατρού για παράνομες συνταγογραφήσεις ,"Ο γιατρός Κέντρου Υγείας στο Περιστέρι έκοβε συνταγές για ναρκωτικά στην μητέρα τοξικομανούς και ασθενούς με ψυχολογικά προβλήματα, η οποία επειδή δεν ήταν ασφαλισμένη όπως και ο γιος της, του πήγαινε ΑΜΚΑ άλλων πολιτών.",2021-01-25 21:46:00,https://www.news247.gr/img/4540/9122731/169000/w140/140/untitled_1.jpg,ελλάδα,,GR
29, Βρυξέλλες: Στο επίκεντρο η Τουρκία - Επιφυλακτική και όχι αφελής η ΕΕ ,"Στο επίκεντρο των θεμάτων του Συμβουλίων Εξωτερικών Υποθέσεων της ΕΕ η Τουρκία. Διάθεση της Άγκυρας αλλά και απαίτηση συνέπειας στην ""επίθεση φιλίας"" αναφέρουν διπλωματικές πηγές.",2021-01-25 21:05:00,https://www.news247.gr/img/3973/9122748/063000/w140/140/untitled_1.jpg,τουρκία,,TR
30, Λιανεμπόριο: Πρόστιμα 3.300 ευρώ την πρώτη εβδομάδα του ανοίγματος ,Πραγματοποιήθηκαν συνολικά 2.382 έλεγχοι και βεβαιώθηκαν 11 παραβάσεις που αφορούσαν στη μη τήρηση των μέτρων κατά της διασποράς του κορονοϊού.,2021-01-25 20:50:00,https://www.news247.gr/img/7915/9075789/355000/w140/140/pripoliko.jpg,ελλάδα,,GR
31, Μπάιντεν: Κανονικά στον στρατό των ΗΠΑ διεμφυλικά άτομα ,Την απαγόρευση κατάταξης διεμφυλικών ατόμων είχε επιβάλει ο Ντόναλντ Τραμπ. Ο Τζο Μπάιντεν ανέφερε πως η κατάργησή της είναι καλύτερη για τον στρατό και τη χώρα.,2021-01-25 20:44:00,https://www.news247.gr/img/3653/9122735/392000/w140/140/usarmy1.jpg,ελλάδα,,GR
32, Τίνος είναι τελικά το παλάτι; Η απάντηση Πούτιν σε Ναβάλνι ,"Η απάντηση του Ρώσου προέδρου για το πολυτελές οίκημα στη Μαύρη Θάλασσα, το οποίο, σύμφωνα με τον φυλακισμένο επικριτή του Κρεμλίνου, του ανήκει. ",2021-01-25 20:30:00,https://www.news247.gr/img/6799/9122639/843000/w140/140/palati250121.jpg,ελλάδα,,GR
33, Ιταλία: Παραιτείται ο Κόντε ,Το πρωί της Τρίτης αναμένεται να κάνει γνωστή ο Ιταλός πρωθυπουργός την απόφασή του να παραιτηθεί. ,2021-01-25 20:13:00,https://www.news247.gr/img/3876/9122707/929000/w140/140/conte250121.jpg,ιταλία,,IT
34, Ιταλία: Προς παραίτηση ο Κόντε ,Το πρωί της Τρίτης αναμένεται να κάνει γνωστή ο Ιταλός πρωθυπουργός την απόφασή του να παραιτηθεί. ,2021-01-25 20:13:00,https://www.news247.gr/img/3876/9122707/929000/w140/140/conte250121.jpg,ιταλία,,IT
35, Γαλλία: Τηλεοπτικός παραγωγός κατηγορείται από τον ανιψιό του για συνέργεια σε βιασμό ανηλίκου ,"Ο τηλεοπτικός παραγωγός Ζεράρ Λουβέν κατηγορείται από τον ανιψιό του, ότι επέτρεπε στον σύζυγό του να τον κακοποιεί σεξουαλικά όταν ήταν ανήλικος. Τι απαντά.",2021-01-25 19:56:00,https://www.news247.gr/img/9352/9122668/027000/w140/140/gerard.jpg,γαλλία,,FR
36, Πάτρα: Πυροβολισμοί μετά από τροχαίο - Ένας σοβαρά τραυματίας ,"Δύο αυτοκίνητα συγκρούστηκαν, για άγνωστο μέχρι στιγμής λόγο, και αμέσως μετά κάποιοι από τους επιβαίνοντες άρχισαν να πυροβολούν. ",2021-01-25 19:50:00,https://www.news247.gr/img/8183/7611440/444000/w140/140/atm.jpg,ελλάδα,,GR
37, Στέιτ Ντιπάρτμεντ: Χαιρετίζει την επανέναρξη των διερευνητικών Ελλάδας-Τουρκίας ," Η Ουάσιγκτον χαιρετίζει την επανέναρξη διερευνητικών συνομιλιών Ελλάδας-Τουρκίας, όπως εξέφρασε ο νέος εκπρόσωπος του Στέιτ Ντιπάρτμεντ Νεντ Πράις.",2021-01-25 19:42:00,https://www.news247.gr/img/752/6658508/266000/w140/140/state-department.jpg,ελλάδα,,GR
38, ΣΥΡΙΖΑ: Ζητά αναλυτική ενημέρωση για τις διερευνητικές στην Κωνσταντινούπολη ,"Η αξιωματική αντιπολίτευση με ανακοίνωσή της ""στηρίζει τις διερευνητικές επαφές με την Τουρκία"", αλλά ζητά αναλυτική ενημέρωση για τη στρατηγική που θα ακολουθήσει η Ελλάδα. ""Τέθηκαν θέματα δήθεν γκρίζων ζωνών και αποστρατιωτικοποίησης;""",2021-01-25 19:28:00,https://www.news247.gr/img/1049/9122656/373000/w140/140/mitsotakis250121.jpg,ελλάδα,,GR
39, Πετρέλαιο θέρμανσης: Σε ΦΕΚ η απόφαση - Πόσα παίρνουν οι δικαιούχοι ,"Αναλυτικά τι αναφέρει η απόφαση για το πετρέλαιο θέρμανσης, η οποία εκδόθηκε σε ΦΕΚ. ",2021-01-25 19:17:00,https://www.news247.gr/img/5767/7550684/321000/w140/140/petrelaio-thermansis.jpg,ελλάδα,,GR
40, Κυριακίδου: Αυστηρό μήνυμα στην AstraZeneca και μηχανισμός ελέγχου για τις εξαγωγές εμβολίων ,Αυστηρή προειδοποίηση προς την AstraZeneca για παράδοση των συμπεφωνημένων δόσεων στην ώρα τους απηύθυνε η Επίτροπος Υγείας,2021-01-25 19:12:00,https://www.news247.gr/img/1655/9122686/498000/w140/140/kyriakides.jpg,ελλάδα,,GR
41," Συνελήφθη με ένταλμα, μέλος σπείρας με πλήθος ανατινάξεων ΑΤΜ ","Εξιχνιάσθηκαν 12 περιπτώσεις διαρρήξεων και απόπειρας διαρρήξεων ΑΤΜ, με την μέθοδο «PLOFKRAAK», 8 κλοπές Ι.Χ. αυτοκινήτων και τρεις κλοπές πινακίδων κυκλοφορίας",2021-01-25 19:09:00,https://www.news247.gr/img/6735/7638455/697000/w140/140/covid.jpg,ελλάδα,,GR
42, Μητσοτάκης: Η αγορά των Rafale αντανακλά το δόγμα της εθνικής μας στρατηγικής ,"""Η προμήθεια των 18 Rafale αντανακλά το δόγμα στρατηγικής μας"" δήλωσε ο πρωθυπουργός κατά τη συνάντησή του με την Φλοράνς Παρλί, ενώ ξεκαθάρισε πως ""συζητάμε μόνο οριοθέτηση θαλάσσιων ζωνών"".",2021-01-25 18:50:00,https://www.news247.gr/img/4879/9047439/188000/w140/140/syriza.jpg,ελλάδα,,GR
43, Sputnik V: Έτοιμη για την παραγωγή εκατομμυρίων δόσεων τουρκική εταιρεία ,"Η ολοκλήρωση της διαδικασίας διαβίβασης τεχνολογιών μεταξύ Ρωσίας και Τουρκίας θα ανάψει το ""πράσινο"" φως για την φαρμακευτική εταιρεία που εμφανίζεται έτοιμη για την παραγωγή του ρωσικού εμβολίου.",2021-01-25 18:44:00,https://www.news247.gr/img/6843/9077147/004000/w140/140/emvolio1101220.jpg,ελλάδα,,GR
44, Πούτιν: Παράνομες και επικίνδυνες οι διαμαρτυρίες για τον Ναβάλνι ,"Ο Βλάντιμιρ Πούτιν σε διαδικτυακή ομιλία που είχε με φοιτητές πανεπιστημίου, κάνοντας λόγο για ""τρομοκράτες που βάζουν μπροστά γυναίκες και παιδιά"".",2021-01-25 18:26:00,https://www.news247.gr/img/2081/9120734/916000/w140/140/russia2.jpg,ελλάδα,,GR
45, ΣΥΡΙΖΑ: Πλαστή η εικόνα της κυβέρνησης περί διαχείρισης της πανδημίας ,Ανακοίνωση του ΣΥΡΙΖΑ αναφέρεται στα κρούσματα στα γηροκομεία Βόλου και Αμαρουσίου και κατηγορεί της κυβέρνηση οτι παρουσιάζει πλαστή εικόνα ότι η πανδημία είναι υπό έλεγχο.,2021-01-25 18:16:00,https://www.news247.gr/img/1974/9107326/537000/w140/140/5216274.jpg,ελλάδα,,GR
46, Κορονοϊός: Eνημέρωση για το σχέδιο εμβολιασμών από Θεοδωρίδου και Θεμιστοκλέους - LIVE EIKONA ,Παρακολουθείστε ζωντανά την ενημέρωση των συντακτών Υγείας από την πρόεδρο της Εθνικής Επιτροπής Εμβολιασμών και τον ΓΓ Πρωτοβάθμιας Φροντίδας Υγείας,2021-01-25 18:02:00,https://www.news247.gr/img/5436/9122605/319000/w140/140/mitsotakis_embolia.jpg,ελλάδα,,GR
47," Μητσοτάκης: Κανονικότητα στις αρχές καλοκαιριού, αν όλα πάνε καλά με τα εμβόλια ","Αν τηρηθούν τα χρονοδιαγράμματα στις παραδόσεις εμβολίων, θα επιστρέψουμε σε μια κάποια κανονικότητα τέλη άνοιξης με αρχές καλοκαιριού, είπε ο πρωθυπουργός στο World Economic Forum. ",2021-01-25 18:00:00,https://www.news247.gr/img/3350/9122559/377000/w140/140/panagiotopoulos.jpg,ελλάδα,,GR
